,Clinic,Location,Bus Route,Cross Streets,Hours,Language,Patient Eligibility,Special Populations Served,Payer Population Served,Payment Practices,Required Documents,Service Description,Clinical Services,Routine Services,Clinic Type
60,;St. Ann Center for Intergenerational Care;Bucyrus Campus Clinic;,";2450 W North Avenue, Milwaukee, WI 53205;(414) 210-2430;  (Fax) 414-210-2434;stanncenter.org;  lwheeler@stanncenter.org;","s: 21, 23, and 27, BlueLine, and PurpleLine;", N 24th Street and W North Avenue;,  Wednesday 9:00 am – 5:30 pm ; Call to schedule an appointment; Walk-ins accepted occasionally;, English; inquire about interpretation services when ;scheduling an appointment;,; Adults 18 – 65;,, Commercial Insurance; Medicaid / ;BadgerCare; Medicare; Qualified Health Plan Insurer; Uninsured;, $50.00 for uninsured patients; clinic bills 3rd ;party payer;," Photo identification, copy of insurance ;card(s) ;",";The St Ann Center for Intergenerational Care, Bucyrus Campus is currently ;providing services with a neurologist specialist for new and existing patients with ;neurological pre- and post-diagnoses, as well as Parkinson’s disease.;",;  Laboratory Services  ;(by referral);  Medication Services;  Radiology Services  ;(by referral);  Specialty Services ;  Neurology;,,Medical;;
61,;St. Ann Center for Intergenerational Care;Gardetto Family Community Dental Clinic;,";2450 W North Avenue, Milwaukee, WI 53205;(414) 210-2440;  Fax: (414) 210-2444;www.stanncenter.org;  klopac@stanncenter.org;","s: 21, 23, 27, BlueLine, and PurpleLine;", N 24th Street and W North Avenue;," Monday, Tuesday, Thursday and Friday 8:00 am – 5:00 pm; ; Call to schedule an appointment;"," English, Spanish, Interpreter Services;",; Age 11 and older; By referral only;, Persons with Moderate to Severe ;Cognitive or Physical Disabilities;, Commercial Insurance; Medicaid / ;BadgerCare; Uninsured;, Private pay patients are offered a 20% dis-;count and a no interest payment plan;, St. Ann Welcome Packet; referral from ;medical doctor or dentist; guardian consent form; medication list;,;This is a specialized clinic for those with moderate to severe cognitive and physi-;cal disabilities who find it challenging to be seen in a standard dental clinic or ;private practice. Patients must reside in the state of Wisconsin and have a referral ;from a medical doctor or dentist explaining their special needs. The clinic provides ;all services that are offered in a standard office except orthodontic and implant ;work. The clinic accepts all Wisconsin State insurance.;,;  Dental Health Services for ;Wisconsin residents with ;moderate to severe cogni-;tive and physical disabilities;   Prevention/Hygiene/ ;Prophylactic Services;   Restorative Dental  ;Services;  Tooth Extractions;    ;,,Dental;;
62,;UMOS Latina Resource Center (LRC) ;HIV Counseling and Testing Program;,";802 W Historic Mitchell Street, Milwaukee, WI 53204;(414) 389-6507;www.umos.org; Gina.Allende@umos.org;","s: 19, 54, and 80;", S 8th and W Historic Mitchell Streets;, Monday and Thursday 9:00 am – 4:00 pm; Call to schedule an appointment; Walk-ins accepted;," English, Spanish, Language Line;", ;  Ages 12 and older;,,, Completely free to all users;, Call to inquire;,";Funded through the WI Department of Health Services, UMOS offers free ;individualized, anonymous, and confidential HIV and STI testing, syringe/needle ;exchange, condom distribution and resource/referral services in English and ;Spanish.;",,; HIV; STD;,STD/HIV;;
63,;United Community Center – Human Services Department;,";1111 S 6th Street, 3rd floor, Milwaukee WI 53204;(414) 643-8530; Fax: (414) 647-8602;www.unitedcc.org; cervera83@gmail.com;",s: 80 ;, S 6th and W Washington Streets;, Monday – Thursday 7:00 am - 6:00 pm;  ;Friday 7:00 am – 5:00 pm; Call to schedule an appointment;  Walk-ins accepted (arrive at 7:00 am);," English, Spanish;", ; Adults 18 - 65; Clinic will assist with insurance enrollment for established patients;, Pregnant Women;, Medicaid / BadgerCare; Uninsured;, Sliding fee scale; clinic bills 3rd party payer;, Call to inquire;,";The Human Services Department at the United Community Center provides bilin-;gual and culturally competent programs for Hispanics and other minorities with ;alcohol and other drug abuse problems. Substance use disorder treatment services ;are available at multiple service levels depending on need: residential treatment, ;day treatment, outpatient treatment. All treatment services provided are available ;for men and women.;",; Behavioral Health Services;  Therapy; Social Work Services; Substance Use Disorder ;Services;,; HIV;,Behavioral Health;;
64,;UWM House of Peace Community Nursing Center;,";1702 W Walnut Street, Milwaukee, WI 53205 ;(414) 933-1590; Fax: (414) 933-0135;uwm.edu/nursing/community/house-of-peace/ ;","s: 12, 23, and 57;", N 17th and W Walnut Streets;, Monday – Thursday 9:00 am – 4:00 pm  ;  Call to schedule an appointment; ;, English;,; Adults 18 – 65;,,," Clinic is cash only fee for service; clinic does ;not accept insurance, credit cards, or checks; payment is required ;at time of service;", Photo ID;,";Nurse-led services include information and referral to community based resources. ;Available services are limited to TB skin tests, breast prosthesis and supplies for ;breast cancer survivors, health information and referral and select health screen-;ings.;",; Women’s Health Services;,; Diabetes; Dietary/Nutrition Services;  Health Information  ;and Referral; TB Testing;,Medical  ;Free or Charitable Clinic;;
65,;UWM Silver Spring Community Nursing Center;,";5460 N 64th Street, Room 143, Milwaukee, WI 53218 ;(414) 535-0432;  Fax: 414-535-0373;uwm.edu/nursing/community/silver-spring/ ;","s: 63, BlueLine;", N 64th Street and W Sheridan Avenue;, Monday – Thursday 9:00 am – 4:00 pm;  ;Friday 9:00 am – Noon;  Call to schedule an appointment ;," English, Language Line;",; Adults 18 – 65; Clinic will assist with insurance enrollment for established patients;,, Medicaid / BadgerCare; Qualified ;Health Plan Insurer; Uninsured;, Nominal fee for service;  clinic bills 3rd party ;payer.  ;, Based on specific program enrollment ;requirements ;,;This nurse-led clinic provides primary health care with integrated behavioral health ;and health promotion services. An appointment is required. People who already ;have a primary care provider will be referred to that provider for any care needs.;,;  Health Insurance  ;Navigation Services;    Medication Services ;(sample medications  ;may be available for  ;registered clients as a  ;start to treatment); Primary Care; Women’s Health Services;,; Diabetes; Pregnancy Testing; TB Testing;,Medical  ;Free or Charitable Clinic;;
66,;Whole Health Clinical Group;,";932 S. 60th St., West Allis, WI 53214;(414) 476-9675; Fax: (414) 615-0627;",s: 23 and 64;, S 60th Street and W Greenfield Avenue;," Monday-Friday, 8:00 am-4:30 pm; Call to schedule an appointment; Walk-ins accepted;"," English, Spanish, Language Line;",; Ages 18-65;  Clinic will assist with insurance enrollment for established  ;patients;," Individuals with behavioral health, ;co-occurring, and trauma issues;", Commercial Insurance; Medicaid / ;BadgerCare; Qualified Health Plan Insurer;, Sliding fee scale;, Proof of identification and insurance; ;,;Whole Health Clinical Group (WHCG) is a Community Health Organization. WHCG ;Integrated Behavioral Health Medical Home provides primary care services to ;individuals with severe mental illness (the most high-risk population for chronic ;medical conditions) as well as people recovering from mental illness and sub-;stance abuse. WHCG is also a licensed outpatient mental health and substance ;abuse clinic; it provides case management services. An on-site pharmacy is avail-;able to consumers.;,; Behavioral Health Services;  Psychiatric Services  ;  Health Insurance ;Navigation Services; Laboratory Services; Pharmacy On-site; Social Work Services;  Substance Use Disorder ;Services;,,Behavioral Health;;
